id,question,expected_type,flat_rag_answer,graph_rag_answer,winner,notes
18,"How are OpenAI Foundation, OpenAI Group PBC, the nonprofit, and Microsoft connected in the graph?",multi-hop,"The context provides information about the connections between OpenAI Foundation, OpenAI Group PBC, the nonprofit, and Microsoft. OpenAI Foundation is the nonprofit that controls OpenAI Group PBC, which is the for-profit entity formed after OpenAI's restructuring. OpenAI Foundation holds a 26% stake in OpenAI Group PBC, while Microsoft holds a 27% stake. Additionally, all members of the OpenAI Group PBC board of directors are appointed by the OpenAI Foundation, which can remove them at any time. This structure indicates a close relationship between the nonprofit and the for-profit entity, with Microsoft being a significant investor in the for-profit branch. 

Thus, the connections are as follows:
- OpenAI Foundation controls OpenAI Group PBC.
- OpenAI Foundation holds a 26% stake in OpenAI Group PBC.
- Microsoft holds a 27% stake in OpenAI Group PBC.
- The board of OpenAI Group PBC is appointed by OpenAI Foundation.

Overall, the context is sufficient to answer the question.","In the graph context, the connections between OpenAI Foundation, OpenAI Group PBC, the nonprofit, and Microsoft can be summarized as follows:

1. **Ownership Structure**: The OpenAI Foundation owns a 26% stake in OpenAI Group PBC, which indicates a direct financial relationship between the nonprofit and the for-profit entity.

2. **Microsoft's Investment**: Microsoft has invested significantly in OpenAI, including a multi-billion dollar investment deal and a $1 billion investment in OpenAI LP. This investment relationship suggests that Microsoft has a vested interest in the success of OpenAI's initiatives.

3. **Microsoft's Ownership**: Following a restructuring in 2025, Microsoft owned a 27% stake in OpenAI Group PBC, further solidifying its connection to both the for-profit and nonprofit aspects of OpenAI.

4. **Interconnectedness**: The OpenAI Group PBC is part of the OpenAI Foundation, and all board members of the PBC are appointed by the Foundation, indicating a governance link between the nonprofit and the for-profit entity.

In summary, the OpenAI Foundation and OpenAI Group PBC are interconnected through ownership and governance, while Microsoft is linked through significant investments and ownership stakes in the for-profit entity.",GraphRAG,GraphRAG answered with an explicit graph path.
19,"How is OpenAI connected to Nvidia, AMD, Oracle, Google Cloud TPUs, and Azure services?",multi-hop,"OpenAI is connected to Nvidia, AMD, Oracle, Google Cloud TPUs, and Azure services through various partnerships and agreements. OpenAI has sought to reduce its dependence on Nvidia GPUs by exploring alternatives, such as renting Google Cloud's Tensor Processing Units (TPUs) and entering into a significant contract with Oracle for computing power. Additionally, OpenAI has announced multi-billion dollar deals with AMD for chip purchases and has a partnership with Nvidia that includes a potential investment. OpenAI also has a long-standing relationship with Microsoft, which has invested heavily in the company and provides Azure services for its operations.","OpenAI is connected to Nvidia, AMD, Oracle, Google Cloud TPUs, and Azure services through various partnerships and agreements:

1. **Nvidia**: OpenAI has a history of collaboration with Nvidia, including receiving a gifted DGX-1 supercomputer in 2016 and a memorandum of understanding announced in September 2025, which included potential deployment of Nvidia systems.

2. **AMD**: OpenAI announced a multi-billion dollar deal with AMD in October 2025, indicating a significant partnership for hardware supply.

3. **Oracle**: OpenAI signed a contract with Oracle in September 2025 to purchase $300 billion in computing power over five years, establishing a strong connection for cloud computing resources.

4. **Google Cloud TPUs**: OpenAI began renting Google Cloud's Tensor Processing Units (TPUs) in June 2025 to support its services, indicating reliance on Google’s infrastructure for computational needs.

5. **Azure services**: OpenAI has a substantial relationship with Microsoft, which provides Azure cloud computing resources. OpenAI agreed to purchase $250 billion of Azure services, highlighting a deep integration into Microsoft's cloud ecosystem.

These connections illustrate OpenAI's reliance on various technology companies for hardware and cloud computing resources essential for its operations and development of AI technologies.",GraphRAG,GraphRAG answered with an explicit graph path.
20,"Which graph paths show Microsoft expanding from operating systems into cloud, developer tools, gaming, and AI?",multi-hop,The context is insufficient.,"The graph does not contain enough information to identify specific paths showing Microsoft expanding from operating systems into cloud, developer tools, gaming, and AI. While there are mentions of Microsoft's investments in OpenAI and its involvement in cloud computing and gaming, the graph lacks explicit connections or paths that clearly illustrate this expansion across all specified areas.",Tie,Both methods had insufficient context.
