id,question,answer,retrieved_chunks,method
1,"Using the graph paths, how is Microsoft connected to OpenAI through investment, Azure, and Copilot?","Microsoft is connected to OpenAI through several key avenues:

1. **Investment**: Microsoft made an initial investment of $1 billion in OpenAI in 2019, which was part of a series of investments totaling approximately $3 billion by 2022. In January 2023, Microsoft announced an additional investment of $10 billion, further solidifying their financial relationship.

2. **Azure**: A significant portion of Microsoft's investments in OpenAI has been allocated to purchasing time on Microsoft Azure, which is the cloud computing platform that hosts OpenAI's services. This partnership has allowed OpenAI to run its systems on an Azure-based supercomputing platform.

3. **Copilot**: Microsoft integrated OpenAI's models into its Copilot chatbot, which was incorporated into Windows and released as mobile apps. This collaboration highlights the practical application of OpenAI's technology within Microsoft's products.

Overall, these connections illustrate a deepening partnership between Microsoft and OpenAI, characterized by substantial financial investments, shared technological infrastructure, and collaborative product development.","[""OpenAI_chunk_4"", ""OpenAI_chunk_2"", ""OpenAI_chunk_9""]",Flat RAG
2,"Trace the ownership path from OpenAI Global, LLC to OpenAI LP and OpenAI, Inc.","The ownership path from OpenAI Global, LLC to OpenAI LP and OpenAI, Inc. is as follows:

1. OpenAI, Inc. (the nonprofit) controls OpenAI GP LLC.
2. OpenAI GP LLC controls OpenAI LP.
3. OpenAI LP is owned by OpenAI, Inc., OpenAI employees, and investors.
4. OpenAI Global, LLC is owned by OpenAI LP and Microsoft.

Thus, the path is: OpenAI, Inc. → OpenAI GP LLC → OpenAI LP → OpenAI Global, LLC.","[""OpenAI_chunk_2"", ""OpenAI_chunk_9"", ""OpenAI_chunk_4""]",Flat RAG
3,How does Microsoft connect to OpenAI Group PBC after OpenAI's restructuring?,The context is insufficient.,"[""OpenAI_chunk_3"", ""OpenAI_chunk_4"", ""OpenAI_chunk_2""]",Flat RAG
4,What graph path connects ChatGPT to Microsoft through OpenAI?,The context is insufficient.,"[""OpenAI_chunk_11"", ""OpenAI_chunk_4"", ""OpenAI_chunk_12""]",Flat RAG
5,How are Sam Altman and Microsoft connected through OpenAI's 2023 leadership crisis?,"Sam Altman and Microsoft are connected through OpenAI's 2023 leadership crisis as Microsoft, along with other investors, pressured OpenAI's board to reinstate Altman after his removal as CEO. Following negotiations that ultimately failed to reinstate him, Microsoft announced that Altman and Greg Brockman would join Microsoft to lead a new advanced AI research team, indicating Microsoft's commitment to Altman despite the turmoil at OpenAI.","[""OpenAI_chunk_14"", ""OpenAI_chunk_0"", ""OpenAI_chunk_15""]",Flat RAG
6,How is Elon Musk connected to OpenAI and Sam Altman through lawsuits and bids?,"Elon Musk is connected to OpenAI and Sam Altman through a series of lawsuits. On February 29, 2024, Musk filed a lawsuit against OpenAI and CEO Sam Altman, claiming they shifted focus from public benefit to profit maximization. OpenAI dismissed this lawsuit as ""incoherent"" and ""frivolous."" Musk later revived legal action against Altman and others in August 2024. In response, OpenAI countersued Musk on April 9, 2024, alleging he engaged in ""bad-faith tactics"" to hinder the company's progress and seize its innovations for personal benefit. Musk's legal actions included a demand to undo OpenAI's transition from a non-profit to a for-profit structure, and he began testifying against Altman and OpenAI in a jury trial that started in April 2026. 

Thus, the context provides sufficient information about Musk's legal connections to OpenAI and Altman through lawsuits and bids.","[""OpenAI_chunk_20"", ""OpenAI_chunk_0"", ""OpenAI_chunk_14""]",Flat RAG
7,"Which cloud and compute providers are connected to OpenAI, and what roles do they play?",The context is insufficient.,"[""Cloud_computing_chunk_13"", ""OpenAI_chunk_2"", ""OpenAI_chunk_4""]",Flat RAG
8,How is The Stargate Project connected to OpenAI and other infrastructure partners?,The context is insufficient.,"[""OpenAI_chunk_4"", ""OpenAI_chunk_5"", ""OpenAI_chunk_2""]",Flat RAG
9,"Which OpenAI products or models are connected to GPT-2, GPT-3, GPT-4, DALL-E, Sora, Operator, and ChatGPT?","The OpenAI products or models connected to GPT-2, GPT-3, GPT-4, DALL-E, Sora, Operator, and ChatGPT are as follows:

- **GPT-2**: Announced in February 2019, known for generating human-like text.
- **GPT-3**: Announced in 2020, a language model for natural language processing tasks.
- **GPT-4**: Released on March 14, 2023, as an API and a feature of ChatGPT Plus.
- **DALL-E**: Introduced in 2021, a model for generating images from textual descriptions, based on a variant of the GPT-3 architecture.
- **Sora**: Launched in December 2024, a text-to-video model.
- **Operator**: Released on January 23, 2025, an AI agent for accessing websites to execute user-defined goals.
- **ChatGPT**: Launched in December 2022, based on GPT-3.5, and includes various features like ChatGPT Pro and ChatGPT Atlas.

These products and models are interconnected through their development and underlying technologies.","[""OpenAI_chunk_11"", ""OpenAI_chunk_12"", ""OpenAI_chunk_10""]",Flat RAG
10,"How is OpenAI connected to government or defense entities such as DoD, AFRICOM, and Anduril?","OpenAI is connected to government and defense entities such as the Department of Defense (DoD), AFRICOM, and Anduril through various contracts and partnerships. OpenAI provides large language models (LLMs) to the DoD and has been involved in projects like the Artificial Intelligence Cyber Challenge and the Advanced Research Projects Agency for Health. In October 2024, it was reported that OpenAI's tools are deemed ""essential"" for AFRICOM's mission and are included in a contractual agreement with Microsoft. Additionally, OpenAI partnered with Anduril in December 2024 to develop drone defense technologies. In June 2025, the DoD awarded OpenAI a significant contract to develop AI tools for military applications, and OpenAI announced a program to provide access to its models for government entities. Furthermore, in February 2026, OpenAI reached an agreement with the DoD to deploy its models in classified networks, although concerns about domestic surveillance and autonomous weapons were raised in relation to this agreement.","[""OpenAI_chunk_10"", ""OpenAI_chunk_9"", ""OpenAI_chunk_2""]",Flat RAG
11,How is Ilya Sutskever connected to OpenAI's safety and superalignment story?,"Ilya Sutskever is connected to OpenAI's safety and superalignment story as he was the former chief scientist and co-leader of the superalignment project, which aimed to align future superintelligent systems. He argued that open-sourcing increasingly capable models was risky due to safety concerns. Sutskever left OpenAI in May 2024, which coincided with the end of the superalignment project.","[""OpenAI_chunk_12"", ""OpenAI_chunk_0"", ""OpenAI_chunk_15""]",Flat RAG
12,"What path connects Microsoft to MS-DOS, Windows, Windows NT, and Xbox?","The path that connects Microsoft to MS-DOS, Windows, Windows NT, and Xbox is the evolution of its operating systems and hardware products. Microsoft started with MS-DOS, which was foundational for its early operating systems. This led to the development of Windows as a graphical extension of MS-DOS, followed by Windows NT, which unified the Windows operating systems under a new codebase. Finally, Microsoft expanded into hardware with the release of the Xbox, marking its entry into the video game console market.","[""Microsoft_chunk_2"", ""Microsoft_chunk_4"", ""Microsoft_chunk_3""]",Flat RAG
13,"How are Bill Gates, Paul Allen, Traf-O-Data, and Microsoft connected?","Bill Gates and Paul Allen are connected through their founding of Traf-O-Data and later Microsoft. They started Traf-O-Data in 1972 to sell a computer that tracked automobile traffic data. Their experience and skills in programming led them to create a BASIC interpreter for the Altair 8800 microcomputer, which ultimately resulted in the establishment of Microsoft on April 4, 1975. Thus, Traf-O-Data was an early venture that laid the groundwork for their later success with Microsoft.","[""Microsoft_chunk_1"", ""Microsoft_chunk_0"", ""Microsoft_chunk_2""]",Flat RAG
14,"How is Microsoft connected to GitHub, LinkedIn, and Activision Blizzard through acquisitions?","Microsoft is connected to GitHub, LinkedIn, and Activision Blizzard through acquisitions as follows:

1. **GitHub**: Microsoft announced its intent to acquire GitHub for $7.5 billion, and the deal closed on October 26, 2018. GitHub continues to operate independently under Microsoft.

2. **LinkedIn**: The context does not provide specific details about the acquisition of LinkedIn, but it is known that Microsoft acquired LinkedIn in 2016 for approximately $26.2 billion.

3. **Activision Blizzard**: Microsoft announced the acquisition of Activision Blizzard in January 2022 for $68.7 billion, and the deal was completed on October 13, 2023.

The context is insufficient to provide details about the LinkedIn acquisition.","[""GitHub_chunk_5"", ""GitHub_chunk_2"", ""Microsoft_chunk_10""]",Flat RAG
15,"How does Satya Nadella connect to Steve Ballmer, Microsoft, and Sam Altman?","Satya Nadella connects to Steve Ballmer as his successor as CEO of Microsoft, having taken over the role in 2014 after Ballmer stepped down. Nadella has since led Microsoft in a shift towards cloud computing and other technologies. He also connects to Sam Altman through recent events where Microsoft expressed support for Altman during his removal as CEO of OpenAI, and subsequently announced that Altman and Greg Brockman would be joining Microsoft to lead a new advanced AI research team. Thus, Nadella is linked to both Ballmer and Altman through their roles and recent developments at Microsoft and OpenAI.","[""OpenAI_chunk_14"", ""Microsoft_chunk_6"", ""Microsoft_chunk_0""]",Flat RAG
16,"How is OpenAI connected to News Corp, The New York Times, and copyright-related disputes?","OpenAI is connected to News Corp and The New York Times through a series of copyright-related disputes. On May 22, 2024, OpenAI entered into an agreement with News Corp to integrate content from its publications, including The Wall Street Journal and The New York Post, into its AI platform. However, The New York Times, along with other publications, has sued OpenAI for copyright infringement, alleging that the company unlawfully used their content to train its AI models. This pattern of legal action reflects ongoing tensions between OpenAI and various media organizations regarding the use of copyrighted material.","[""OpenAI_chunk_19"", ""OpenAI_chunk_18"", ""OpenAI_chunk_2""]",Flat RAG
17,"How does OpenAI connect to Whisper, YouTube transcription, and GPT-4 training?",The context is insufficient.,"[""OpenAI_chunk_18"", ""OpenAI_chunk_11"", ""OpenAI_chunk_12""]",Flat RAG
18,"How are OpenAI Foundation, OpenAI Group PBC, the nonprofit, and Microsoft connected in the graph?","The context provides information about the connections between OpenAI Foundation, OpenAI Group PBC, the nonprofit, and Microsoft. OpenAI Foundation is the nonprofit that controls OpenAI Group PBC, which is the for-profit entity formed after OpenAI's restructuring. OpenAI Foundation holds a 26% stake in OpenAI Group PBC, while Microsoft holds a 27% stake. Additionally, all members of the OpenAI Group PBC board of directors are appointed by the OpenAI Foundation, which can remove them at any time. This structure indicates a close relationship between the nonprofit and the for-profit entity, with Microsoft being a significant investor in the for-profit branch. 

Thus, the connections are as follows:
- OpenAI Foundation controls OpenAI Group PBC.
- OpenAI Foundation holds a 26% stake in OpenAI Group PBC.
- Microsoft holds a 27% stake in OpenAI Group PBC.
- The board of OpenAI Group PBC is appointed by OpenAI Foundation.

Overall, the context is sufficient to answer the question.","[""OpenAI_chunk_3"", ""OpenAI_chunk_2"", ""OpenAI_chunk_4""]",Flat RAG
19,"How is OpenAI connected to Nvidia, AMD, Oracle, Google Cloud TPUs, and Azure services?","OpenAI is connected to Nvidia, AMD, Oracle, Google Cloud TPUs, and Azure services through various partnerships and agreements. OpenAI has sought to reduce its dependence on Nvidia GPUs by exploring alternatives, such as renting Google Cloud's Tensor Processing Units (TPUs) and entering into a significant contract with Oracle for computing power. Additionally, OpenAI has announced multi-billion dollar deals with AMD for chip purchases and has a partnership with Nvidia that includes a potential investment. OpenAI also has a long-standing relationship with Microsoft, which has invested heavily in the company and provides Azure services for its operations.","[""OpenAI_chunk_9"", ""OpenAI_chunk_4"", ""OpenAI_chunk_2""]",Flat RAG
20,"Which graph paths show Microsoft expanding from operating systems into cloud, developer tools, gaming, and AI?",The context is insufficient.,"[""Microsoft_chunk_0"", ""Microsoft_chunk_10"", ""Microsoft_chunk_7""]",Flat RAG
