subject,relation,object,evidence,chunk_id,source_title
Steve Ballmer,FOUNDED_BY,Bill Gates,an old college friend of Gates and employee of the company since 1980.,Microsoft_chunk_3,Microsoft
Steve Ballmer,STEPS_DOWN_AS,CEO of Microsoft,"On February 4, 2014, Steve Ballmer stepped down as CEO of Microsoft.",Microsoft_chunk_6,Microsoft
Bill Gates,FOUNDED_BY,Traf-O-Data,"In 1972, they founded Traf-O-Data.",Microsoft_chunk_1,Microsoft
Bill Gates,HANDED_OVER,CEO position,"On January 13, 2000, Bill Gates handed over the CEO position to Steve Ballmer.",Microsoft_chunk_3,Microsoft
Bill Gates,CHIEF_EXECUTIVE_OF,Microsoft,Chief executives Bill Gates (1975–2000) Steve Ballmer (2000–2014) Satya Nadella (2014–present),Microsoft_chunk_14,Microsoft
Surface,UNVEILED_IN,June 2012,The Surface was unveiled in June 2012,Microsoft_chunk_5,Microsoft
Satya Nadella,BECAME,CEO,Since Satya Nadella became CEO in 2014.,Microsoft_chunk_0,Microsoft
Satya Nadella,SUCCEEDED,Steve Ballmer,was succeeded by Satya Nadella.,Microsoft_chunk_6,Microsoft
Satya Nadella,ANNOUNCED,Sam Altman and Greg Brockman,"On November 20, 2023, Satya Nadella announced that Sam Altman... and Greg Brockman... would join Microsoft to lead a new advanced AI research team.",Microsoft_chunk_11,Microsoft
Microsoft Gaming division,FOUNDED_BY,Phil Spencer,"Microsoft also named Phil Spencer, head of the Xbox brand since 2014, the inaugural CEO of the newly established Microsoft Gaming division.",Microsoft_chunk_10,Microsoft
Activision Blizzard,RELATED_TO,Bobby Kotick,"reports have alleged that Activision CEO Bobby Kotick, a major target of the controversy, would leave the company after the acquisition is finalized.",Microsoft_chunk_10,Microsoft
Activision Blizzard,AFFECTED_BY,layoffs,The layoffs primarily affected Activision Blizzard employees,Microsoft_chunk_16,Microsoft
Traf-O-Data,PART_OF,Microsoft,"In 1972, they founded Traf-O-Data, which sold a rudimentary computer to track and analyze automobile traffic data.",Microsoft_chunk_1,Microsoft
Paul Allen,RESIGNED_FROM,Microsoft,Paul Allen resigned from Microsoft in 1983 after developing Hodgkin's lymphoma.,Microsoft_chunk_2,Microsoft
IBM,AWARDED,contract to Microsoft,IBM awarded a contract to Microsoft in November 1980 to provide a version of the CP/M OS to be used in the IBM Personal Computer (IBM PC).,Microsoft_chunk_1,Microsoft
IBM,COPYRIGHTED,IBM PC BIOS,IBM had copyrighted the IBM PC BIOS.,Microsoft_chunk_2,Microsoft
Windows 1.0,PART_OF,MS-DOS,as a graphical extension for MS-DOS.,Microsoft_chunk_2,Microsoft
Federal Trade Commission,EXAMINED,Microsoft,the Federal Trade Commission examined Microsoft for possible collusion due to the partnership with IBM.,Microsoft_chunk_2,Microsoft
Microsoft Windows NT,BASED_ON,OS/2 code,which was heavily based on its copy of the OS/2 code.,Microsoft_chunk_2,Microsoft
Microsoft Windows NT,SHIPPED_ON,"July 21, 1993","It shipped on July 21, 1993.",Microsoft_chunk_2,Microsoft
Microsoft Office,BUNDLED,Microsoft Word and Microsoft Excel,which bundled separate applications such as Microsoft Word and Microsoft Excel.,Microsoft_chunk_2,Microsoft
Windows 3.0,FEATURED,streamlined user interface graphics,featuring streamlined user interface graphics and improved protected mode capability for the Intel 386 processor.,Microsoft_chunk_2,Microsoft
Department of Justice's Antitrust Division,FILED,competitive impact statement,the Department of Justice's Antitrust Division filed a competitive impact statement.,Microsoft_chunk_2,Microsoft
Windows 95,FEATURES,pre-emptive multitasking,"Windows 95 featuring pre-emptive multitasking, a completely new user interface with a novel start button, and 32-bit compatibility.",Microsoft_chunk_3,Microsoft
Windows 95,BUNDLED_WITH,MSN,Windows 95 came bundled with the online service MSN.,Microsoft_chunk_3,Microsoft
MSNBC,RUN_AS,joint venture with NBC,which it had run as a joint venture with NBC since 1996.,Microsoft_chunk_6,Microsoft
Windows XP,PART_OF,NT codebase,unifying the mainstream and NT lines of OS under the NT codebase.,Microsoft_chunk_4,Microsoft
Xbox,ENTERED,video game console market,entering the video game console market dominated by Sony and Nintendo.,Microsoft_chunk_4,Microsoft
Xbox,AFFECTED_BY,layoffs,some Xbox and ZeniMax employees were also affected,Microsoft_chunk_16,Microsoft
European Union,BROUGHT,antitrust legal action,In March 2004 the European Union brought antitrust legal action against the company.,Microsoft_chunk_4,Microsoft
European Union,IMPOSED,fine of €899 million,The European Union imposed another fine of €899 million for Microsoft's lack of compliance.,Microsoft_chunk_4,Microsoft
Zune series,SUCCESSOR_OF,Portable Media Center,a successor of its previous software platform Portable Media Center.,Microsoft_chunk_4,Microsoft
Microsoft Office 2007,FEATURED,Ribbon user interface,"Microsoft Office 2007, released at the same time, featured a 'Ribbon' user interface.",Microsoft_chunk_4,Microsoft
Gates,RETIRED_FROM,Chief Software Architect,"Gates retired from his role as Chief Software Architect on June 27, 2008.",Microsoft_chunk_4,Microsoft
Gates,LEFT,board of directors of Microsoft,"On March 13, 2020, Gates announced that he is leaving the board of directors of Microsoft",Microsoft_chunk_13,Microsoft
Azure Services Platform,LAUNCHED,cloud computing market,"Azure Services Platform, the company's entry into the cloud computing market for Windows, launched on October 27, 2008.",Microsoft_chunk_4,Microsoft
Microsoft Store,OPENED_IN,"Scottsdale, Arizona","the first retail Microsoft Store opened in Scottsdale, Arizona",Microsoft_chunk_5,Microsoft
Windows 7,RELEASED_ON,"October 22, 2009",the same day Windows 7 was officially released to the public,Microsoft_chunk_5,Microsoft
Windows Mobile,REPLACED_BY,Windows Phone OS,"Microsoft revamped its aging flagship mobile operating system, Windows Mobile, replacing it with the new Windows Phone OS",Microsoft_chunk_5,Microsoft
Windows Phone OS,USES,Metro design language,"It used a new user interface design language, codenamed 'Metro'",Microsoft_chunk_5,Microsoft
Open Networking Foundation,FOCUSED_ON,Software-Defined Networking,This nonprofit organization is focused on providing support for a cloud computing initiative called Software-Defined Networking,Microsoft_chunk_5,Microsoft
Windows 8,UNVEILED_IN,June 2011,"Microsoft unveiled Windows 8, an operating system designed to power both personal computers and tablet computers, in Taipei in June 2011",Microsoft_chunk_5,Microsoft
Skype,SHUTTING_DOWN_ON,"May 5, 2025","Microsoft announced that Skype would be shutting down on May 5, 2025.",Microsoft_chunk_12,Microsoft
New York City Police Department,PARTNERED_WITH,Microsoft,the New York City Police Department announced a partnership with Microsoft.,Microsoft_chunk_6,Microsoft
Domain Awareness System,USED_FOR,police surveillance in New York City,for the development of the Domain Awareness System which is used for police surveillance in New York City.,Microsoft_chunk_6,Microsoft
Kinect,MADE_BY,Microsoft,"The Kinect, a motion-sensing input device made by Microsoft.",Microsoft_chunk_6,Microsoft
Kinect,DESIGNED_AS,video game controller,designed as a video game controller.,Microsoft_chunk_6,Microsoft
Microsoft Mobile Oy,RENAMED_FROM,Nokia Devices and Services,This new subsidiary was renamed Microsoft Mobile Oy.,Microsoft_chunk_6,Microsoft
Mojang,BEST_KNOWN_FOR,Minecraft,best known for Minecraft.,Microsoft_chunk_6,Microsoft
Windows 10,RELEASED_BY,Microsoft,"On July 29, 2015, Windows 10 was released.",Microsoft_chunk_6,Microsoft
Nadella,BECAME,CEO of Microsoft,"Since Nadella became CEO, the company has changed focus towards cloud computing.",Microsoft_chunk_7,Microsoft
Phil Spencer,ANNOUNCED,focus on Universal Windows Platform (UWP) apps,with Phil Spencer announcing that Universal Windows Platform (UWP) apps would be the focus for Microsoft's gaming in the future.,Microsoft_chunk_7,Microsoft
Intune for Education,IS,cloud-based application and device management service,Intune for Education is a new cloud-based application and device management service for the education sector.,Microsoft_chunk_7,Microsoft
Microsoft Azure Information Protection,AIMS_TO,help enterprises protect their data,It aims to help enterprises protect their data as it moves between servers and devices.,Microsoft_chunk_7,Microsoft
Azure Government,RELATED_TO,Joint Enterprise Defense Infrastructure (JEDI),The project is dubbed 'Azure Government' and has ties to the Joint Enterprise Defense Infrastructure (JEDI) surveillance program.,Microsoft_chunk_8,Microsoft
Microsoft Teams,CONVERTED_TO,gratis,"Later in the month, it converted Microsoft Teams to gratis.",Microsoft_chunk_8,Microsoft
Toyota Tsusho,PARTNERED_WITH,Microsoft,"In August 2018, Toyota Tsusho began a partnership with Microsoft to create fish farming tools using the Microsoft Azure application suite for Internet of things (IoT) technologies related to water management.",Microsoft_chunk_8,Microsoft
Water pump mechanisms,DEVELOPED_BY,Kindai University researchers,"Developed in part by researchers from Kindai University, the water pump mechanisms use artificial intelligence to count the number of fish on a conveyor belt.",Microsoft_chunk_8,Microsoft
Project Mu,PROMOTES,Firmware as a Service,The project promotes the idea of Firmware as a Service.,Microsoft_chunk_8,Microsoft
Project Mu,USES,Unified Extensible Firmware Interface (UEFI),an open source release of the Unified Extensible Firmware Interface (UEFI) core used in Microsoft Surface and Hyper-V products.,Microsoft_chunk_9,Microsoft
Microsoft Edge [Legacy],PART_OF,New Edge,"in favor of the 'New Edge' browser project, featuring a Chromium based backend.",Microsoft_chunk_9,Microsoft
ZeniMax Media,PART_OF,Xbox Game Studios,the acquisition was finalized at $8.1 billion and ZeniMax Media became part of Microsoft's Xbox Game Studios division.,Microsoft_chunk_9,Microsoft
Azure Quantum,PROVIDES,access to quantum software and quantum hardware,"The public cloud computing platform provides access to quantum software and quantum hardware including trapped ion, neutral atom, and superconducting systems.",Microsoft_chunk_9,Microsoft
Windows 11,RELEASED,"October 5, 2021","It was released to the general public on October 5, 2021.",Microsoft_chunk_9,Microsoft
Azure Quantum Elements,USES,"AI, high-performance computing and quantum computing","using a combination of AI, high-performance computing and quantum computing.",Microsoft_chunk_10,Microsoft
Azure Quantum Elements,PROVIDES,Copilot,"The service includes Copilot, a GPT-4 based large language model tool.",Microsoft_chunk_10,Microsoft
Maia chip,DESIGNED_FOR,large language models,"The Maia chip, designed to run large language models.",Microsoft_chunk_10,Microsoft
Cobalt CPU,DESIGNED_FOR,general cloud services on Azure,"Cobalt CPU, designed to power general cloud services on Azure.",Microsoft_chunk_10,Microsoft
CrowdStrike's cybersecurity software,CAUSED,Microsoft systems crashing,"The outage was traced back to a flawed update of CrowdStrike's cybersecurity software, which resulted in Microsoft systems crashing.",Microsoft_chunk_11,Microsoft
BlackRock and Microsoft,ANNOUNCED,$30 billion fund,"In September 2024, BlackRock and Microsoft announced a $30 billion fund.",Microsoft_chunk_11,Microsoft
Global AI Infrastructure Investment Partnership,FOUNDED_BY,BlackRock and Microsoft,"BlackRock and Microsoft announced a $30 billion fund, the Global AI Infrastructure Investment Partnership.",Microsoft_chunk_11,Microsoft
AI Infrastructure Investment Partnership,INVESTS_IN,AI infrastructure,"AI Infrastructure Investment Partnership, to invest in AI infrastructure such as data centers and energy projects.",Microsoft_chunk_12,Microsoft
AI Infrastructure Investment Partnership,PARTNERED_WITH,MGX,"Partners include Abu Dhabi-backed MGX and Nvidia, which will provide AI expertise.",Microsoft_chunk_12,Microsoft
AI Infrastructure Investment Partnership,PARTNERED_WITH,Nvidia,"Partners include Abu Dhabi-backed MGX and Nvidia, which will provide AI expertise.",Microsoft_chunk_12,Microsoft
Investments,FOCUSES_ON,U.S.,"Investments will primarily focus on the U.S., with some in partner countries.",Microsoft_chunk_12,Microsoft
Recall,CHANGED_TO,opt-in feature,Recall was changed to an opt-in feature instead of being default on.,Microsoft_chunk_12,Microsoft
UK's Information Commissioner's Office,MONITORED,Recall adjustments,The UK's Information Commissioner's Office monitored the situation and noted the adjustments.,Microsoft_chunk_12,Microsoft
Recall adjustments,INCLUDED,enhanced security measures,which included enhanced security measures like encryption and biometric access.,Microsoft_chunk_12,Microsoft
Microsoft Rus LLC,FILED_FOR,bankruptcy,"Microsoft's Russian division, Microsoft Rus LLC, filed for bankruptcy after President Vladimir Putin stated that foreign services providers should be throttled in Russia.",Microsoft_chunk_12,Microsoft
Europol's European Cybercrime Centre,WORKED_WITH,Microsoft,it was reported that Europol's European Cybercrime Centre worked with Microsoft to disrupt Lumma Stealer.,Microsoft_chunk_12,Microsoft
Microsoft-controlled discussion forums,BANNED,nickname Microslop,"In March 2026, Microsoft-controlled discussion forums banned the nickname Microslop.",Microsoft_chunk_12,Microsoft
Copilot Cowork tool,BASED_ON,Claude Cowork,which is based on Claude Cowork,Microsoft_chunk_13,Microsoft
board of directors,ELECTED_BY,majority vote system,Board members are elected every year at the annual shareholders' meeting using a majority vote system,Microsoft_chunk_13,Microsoft
Microsoft's Online Services Division,HAS_BEEN,loss-making since 2006,Microsoft's Online Services Division has been continuously loss-making since 2006.,Microsoft_chunk_14,Microsoft
Microsoft's Online Services Division,LOST,$726 million,in Q1 2011 it lost $726 million.,Microsoft_chunk_14,Microsoft
Services Division,LOSS_MAKING_SINCE,2006,Services Division has been continuously loss-making since 2006,Microsoft_chunk_15,Microsoft
Services Division,LOST,$726 million,in Q1 2011 it lost $726 million,Microsoft_chunk_15,Microsoft
Services Division,LOST,$2.5 billion,This follows a loss of $2.5 billion for the year 2010,Microsoft_chunk_15,Microsoft
aQuantive,ACQUIRED_BY,Microsoft,"due to a writedown related to the advertising company aQuantive, which had been acquired for $6.2 billion back in 2007",Microsoft_chunk_15,Microsoft
U.S. law,REGULATES,corporations do not pay income tax on overseas profits,"Under U.S. law, corporations do not pay income tax on overseas profits until the profits are brought into the United States",Microsoft_chunk_15,Microsoft
augmented reality headset technology,USED_IN,weapon repertoires of American soldiers,to bring augmented reality (AR) headset technology into the weapon repertoires of American soldiers,Microsoft_chunk_15,Microsoft
Microsoft Canada,ESTABLISHED_BY,Microsoft,"An example is Microsoft Canada, which it established in 1985",Microsoft_chunk_15,Microsoft
Windows Server 2003,EASIER_TO_ADMINISTRATE_THAN,Linux,the firms concluded that companies found Windows easier to administrate than Linux,Microsoft_chunk_16,Microsoft
Linux,HAS,lower TCO,its survey concluded that the TCO of Linux was lower,Microsoft_chunk_16,Microsoft
Yankee Group,CONCLUDED,upgrading costs,a study by the Yankee Group concluded that upgrading from one version of Windows Server to another costs a fraction of the switching costs from Windows Server to Linux,Microsoft_chunk_16,Microsoft
Linux servers,PROVIDES,increased security and reliability,companies surveyed noted the increased security and reliability of Linux servers,Microsoft_chunk_16,Microsoft
Microsoft studies,CLAIMED_TO_BE,outdated and one-sided,claimed that the Microsoft studies were 'simply outdated and one-sided',Microsoft_chunk_16,Microsoft
ZeniMax,AFFECTED_BY,layoffs,some Xbox and ZeniMax employees were also affected,Microsoft_chunk_16,Microsoft
